{
  "artifactVersion": 2,
  "messageGrammarVersion": 2,
  "catalog": "canary",
  "locale": "en",
  "contractFingerprint": "sha256:17902d0e9483fdf7672cbbae81398ece6b92c9d24a8f247f3bf8cf3858830ffd",
  "messages": {
    "Greeting": {
      "astVersion": 2,
      "inputs": { "name": { "type": "string", "format": "none" } },
      "selectors": [],
      "variants": [
        {
          "matches": {},
          "nodes": [
            { "kind": "text", "value": "Hi again, " },
            { "kind": "input", "input": "name" },
            { "kind": "text", "value": "!" }
          ]
        }
      ]
    }
  }
}
